<?xml version="1.0" encoding="UTF-8"?>
<!DOCTYPE empresa SYSTEM "file:/C:/Users/Usuario/OneDrive/Documents/Lenguaje%20de%20marcas/XML/DTD/examens2/ej5.dtd">
<empresa>
      <nombre>FERE S.L</nombre>
      <provincia>Sevilla</provincia>
      <CP>41089</CP>
      <departamentos>
          <departamento idDepartamento="num1">
            <nombre>RRHH</nombre>
          </departamento>
          <departamento idDepartamento="num2">
            <nombre>Frescos</nombre>
          </departamento>
      </departamentos>
      <empleados>
      <empleado  idDpto="num1">
          <nombre>Juan</nombre>
          <apellidos>Perez</apellidos>
          <dni>657849998H</dni>
          <provincia>Sevilla</provincia>
          <telefono prefijo="34">123456789</telefono>
      </empleado>
          <empleado  idDpto="num1">
          <nombre>Juanito</nombre>
          <apellidos>Perezo</apellidos>
          <dni>657849998H</dni>
          <provincia>Sevilla</provincia>
          <telefono prefijo="34">123456789</telefono>
      </empleado>
          <empleado  idDpto="num2">
          <nombre>PEPE</nombre>
          <apellidos>Perez</apellidos>
          <dni>60000008H</dni>
          <provincia>Sevilla</provincia>
          <telefono prefijo="34">123456559</telefono>
      </empleado>
      </empleados>
</empresa>